<?xml version="1.0" encoding="UTF-8"?>
<mod:modulo idModulo="MODe0001" xmlns:mod="http://www.piat.upm.es/modulo" 
xmlns:xsi="http://www.w3.org/2001/XMLSchema-instance"
xsi:schemaLocation="http://www.piat.upm.es/modulo modulo.xsd">
    <mod:tipoModulo>
        espec√≠fico
    </mod:tipoModulo>
    <mod:funcionalidad>
        aqui se describe la funcionalidad
    </mod:funcionalidad>
    <mod:componentes>
        <mod:captadores>
            <mod:numeroCaptadores>
                2
            </mod:numeroCaptadores>
            <mod:captador idCaptador="Cap001">
                <mod:parametro>parametro a captar</mod:parametro>
                <mod:medida>
                    0,52 kW/m2
                </mod:medida>
            </mod:captador>
            <mod:captador idCaptador="Cap002">
                <mod:parametro>parametro a captar</mod:parametro>
            </mod:captador>
        </mod:captadores>
    </mod:componentes>
</mod:modulo>