<?xml version="1.0" encoding="UTF-8"?>
<mod:modulo idModulo="MODt0001" xmlns:mod="http://www.piat.upm.es/modulo" 
xmlns:xsi="http://www.w3.org/2001/XMLSchema-instance"
xsi:schemaLocation="http://www.piat.upm.es/modulo modulo.xsd">
    <mod:tipoModulo>
        transmisor
    </mod:tipoModulo>
    <mod:funcionalidad>
        aqui se describe la funcionalidad
    </mod:funcionalidad>
    <mod:componentes>
        <mod:transmisores>
            <mod:numeroTransmisores>
                3
            </mod:numeroTransmisores>
            <mod:transmisor idTransmisor="TR1mfm">
                <mod:parametrosTransmision>
                    <mod:tipoModulacion>
                        BPSK
                    </mod:tipoModulacion>
                    <mod:tiempoVida>
                        2005-11-12 2021-02-02
                    </mod:tiempoVida>
                </mod:parametrosTransmision>
            </mod:transmisor>
            <mod:transmisor idTransmisor="TR2mfm">
                <mod:parametrosTransmision>
                    <mod:tipoModulacion>
                        QPSK
                    </mod:tipoModulacion>
                    <mod:tiempoVida>
                        2008-08-21 2012-09-17
                    </mod:tiempoVida>
                </mod:parametrosTransmision>
            </mod:transmisor>
            <mod:transmisor idTransmisor="TR3mfm">
                <mod:parametrosTransmision>
                    <mod:tipoModulacion>
                        16QAM
                    </mod:tipoModulacion>
                    <mod:tiempoVida>
                        2014-01-31 2019-10-03
                    </mod:tiempoVida>
                </mod:parametrosTransmision>
            </mod:transmisor>
        </mod:transmisores>
    </mod:componentes>
</mod:modulo>